{
  "schema_version": "1.0.0",
  "confidence": "medium",
  "protocol_id": "ipv6-nd",
  "protocol_name": "IPv6 Neighbor Discovery",
  "protocol_family": "adjacency",
  "standard": "RFC 4861 (ND), RFC 4862 (SLAAC), RFC 4443 (ICMPv6)",
  "operates_at": "Layer 3 control plane over Layer 2 (ICMPv6)",
  "transport": "ICMPv6 message types 133-137 (RS/RA/NS/NA/Redirect)",
  "purpose": "IPv6 Neighbor Discovery (ND) is the IPv6 replacement for IPv4 ARP plus ICMP router discovery. It resolves on-link IPv6 addresses to link-layer (MAC) addresses using Neighbor Solicitation/Advertisement (NS/NA), discovers routers and on-link prefixes via Router Solicitation/Advertisement (RS/RA), drives Stateless Address Autoconfiguration (SLAAC), runs Duplicate Address Detection (DAD) before an address is used, and continuously tracks neighbor reachability through Neighbor Unreachability Detection (NUD). All ND messages are ICMPv6 (types 133-137) and use the link-local source address, so a working link-local address and unfiltered ICMPv6 are prerequisites for any IPv6 forwarding on the segment.",
  "def_refs": [
    "daemon:neighsyncd",
    "daemon:orchagent",
    "daemon:syncd",
    "db:appl_db",
    "db:asic_db",
    "db:state_db",
    "db:config_db"
  ],
  "states": [
    {
      "name": "INCOMPLETE",
      "is_failure": false,
      "is_steady": false,
      "description": "Address resolution is in progress: a Neighbor Solicitation has been multicast to the target's solicited-node multicast address, but no Neighbor Advertisement has been received yet. Packets to the neighbor are queued (a small number) and dropped if resolution never completes."
    },
    {
      "name": "REACHABLE",
      "is_failure": false,
      "is_steady": true,
      "description": "Positive confirmation was received within the last ReachableTime milliseconds that the forward path to the neighbor is working. No probing is needed while in this state."
    },
    {
      "name": "STALE",
      "is_failure": false,
      "is_steady": true,
      "description": "More than ReachableTime has elapsed since the last reachability confirmation. The cached link-layer address is still used to send, but reachability is unverified. STALE is normal and is NOT a failure."
    },
    {
      "name": "DELAY",
      "is_failure": false,
      "is_steady": false,
      "description": "A packet was sent to a STALE neighbor; the node waits DELAY_FIRST_PROBE_TIME for an upper-layer reachability hint before actively probing. Transient state."
    },
    {
      "name": "PROBE",
      "is_failure": false,
      "is_steady": false,
      "description": "Reachability is being actively verified by retransmitting unicast Neighbor Solicitations every RetransTimer. If MAX_UNICAST_SOLICIT probes go unanswered the entry is deleted and resolution restarts."
    },
    {
      "name": "TENTATIVE",
      "is_failure": false,
      "is_steady": false,
      "description": "An address (link-local or SLAAC/configured) is undergoing Duplicate Address Detection. It is not yet assigned and cannot be used as a source/destination until DAD completes."
    },
    {
      "name": "DUPLICATE",
      "is_failure": true,
      "is_steady": true,
      "description": "DAD detected another node defending the address (a NA or a competing NS was received for the tentative address). The address is NOT assigned; if it is the interface link-local, IPv6 operation on the interface is disabled (RFC 4862 5.4.5)."
    }
  ],
  "transitions": [
    {
      "from_state": "REACHABLE",
      "to_state": "INCOMPLETE",
      "trigger": "No cache entry exists (or it was flushed) and a packet must be sent: a multicast NS is issued to the solicited-node multicast address."
    },
    {
      "from_state": "INCOMPLETE",
      "to_state": "REACHABLE",
      "trigger": "A solicited Neighbor Advertisement with the Solicited flag set is received."
    },
    {
      "from_state": "INCOMPLETE",
      "to_state": "DUPLICATE",
      "trigger": "After MAX_MULTICAST_SOLICIT (3) NS retransmissions with no NA the entry is discarded and packets to the neighbor are dropped (address unresolvable)."
    },
    {
      "from_state": "REACHABLE",
      "to_state": "STALE",
      "trigger": "ReachableTime (default 30s) elapses since the last positive confirmation, or an unsolicited NA/NS with a different link-layer address is received."
    },
    {
      "from_state": "STALE",
      "to_state": "DELAY",
      "trigger": "A packet is sent to a neighbor whose entry is STALE."
    },
    {
      "from_state": "DELAY",
      "to_state": "PROBE",
      "trigger": "DELAY_FIRST_PROBE_TIME (5s) elapses with no upper-layer reachability confirmation; unicast NS probing begins."
    },
    {
      "from_state": "PROBE",
      "to_state": "REACHABLE",
      "trigger": "A solicited NA is received in response to a unicast probe."
    },
    {
      "from_state": "PROBE",
      "to_state": "INCOMPLETE",
      "trigger": "MAX_UNICAST_SOLICIT (3) unicast probes go unanswered; the entry is deleted and the neighbor must be re-resolved from scratch."
    },
    {
      "from_state": "TENTATIVE",
      "to_state": "REACHABLE",
      "trigger": "DAD completes with no defending NA after DupAddrDetectTransmits probes; the address is assigned and usable."
    },
    {
      "from_state": "TENTATIVE",
      "to_state": "DUPLICATE",
      "trigger": "A Neighbor Advertisement (or a simultaneous DAD NS) is received for the tentative address, proving another node owns it."
    }
  ],
  "timers": [
    {
      "name": "ReachableTime",
      "default_rfc": "30,000 ms (BaseReachableTime; randomized 0.5-1.5x per RFC 4861 §6.3.2)",
      "description": "Time a neighbor remains in REACHABLE after a confirmation before transitioning to STALE. Advertised to hosts in the Router Advertisement Reachable Time field.",
      "on_expiry": "Neighbor cache entry moves REACHABLE -> STALE (still usable; not a failure).",
      "range": "implementation/RFC constant",
      "tuning_advice": "Tens of seconds. Lower for faster failure detection at the cost of more NS probes.",
      "os_defaults": [
        {
          "os": "nxos",
          "default": "30000 ms",
          "config_path": "interface: ipv6 nd reachable-time <ms>",
          "version_range": {
            "min": "*",
            "max": "*"
          }
        },
        {
          "os": "iosxe",
          "default": "30000 ms (0 = unspecified, host picks)",
          "config_path": "interface: ipv6 nd reachable-time <ms>",
          "version_range": {
            "min": "*",
            "max": "*"
          }
        },
        {
          "os": "iosxr",
          "default": "30000 ms",
          "config_path": "interface: ipv6 nd reachable-time <ms>",
          "version_range": {
            "min": "*",
            "max": "*"
          }
        },
        {
          "os": "sonic",
          "default": "Linux kernel base_reachable_time_ms (default 30000)",
          "config_path": "sysctl net.ipv6.neigh.<ifname>.base_reachable_time_ms; managed via kernel + neighsyncd",
          "version_range": {
            "min": "202511",
            "max": "*"
          },
          "frr_path": "neighsyncd mirrors kernel NEIGH state into STATE_DB NEIGH_TABLE"
        }
      ]
    },
    {
      "name": "RetransTimer",
      "default_rfc": "1,000 ms (RFC 4861 §10)",
      "description": "Interval between retransmitted Neighbor Solicitations while resolving (INCOMPLETE) or probing (PROBE). Advertised to hosts in the RA Retrans Timer field.",
      "on_expiry": "Another NS is retransmitted; after MAX_*_SOLICIT attempts the entry is discarded.",
      "range": "implementation/RFC constant",
      "tuning_advice": "1-2 s typical. Too low floods NS; too high slows resolution.",
      "os_defaults": [
        {
          "os": "nxos",
          "default": "1000 ms",
          "config_path": "interface: ipv6 nd retrans-timer <ms>",
          "version_range": {
            "min": "*",
            "max": "*"
          }
        },
        {
          "os": "iosxe",
          "default": "1000 ms",
          "config_path": "interface: ipv6 nd ns-interval <ms>",
          "version_range": {
            "min": "*",
            "max": "*"
          }
        },
        {
          "os": "iosxr",
          "default": "1000 ms",
          "config_path": "interface: ipv6 nd retrans-timer <ms>",
          "version_range": {
            "min": "*",
            "max": "*"
          }
        },
        {
          "os": "sonic",
          "default": "Linux kernel retrans_time_ms (default 1000)",
          "config_path": "sysctl net.ipv6.neigh.<ifname>.retrans_time_ms",
          "version_range": {
            "min": "202511",
            "max": "*"
          }
        }
      ]
    },
    {
      "name": "DELAY_FIRST_PROBE_TIME",
      "default_rfc": "5 s (RFC 4861 §10)",
      "description": "After sending to a STALE neighbor, how long the node waits in DELAY for an upper-layer reachability confirmation before unicast probing (NUD).",
      "on_expiry": "Neighbor cache entry moves DELAY -> PROBE and unicast NS probing begins.",
      "range": "implementation/RFC constant",
      "tuning_advice": "Rarely tuned; kernel/platform constant.",
      "os_defaults": [
        {
          "os": "nxos",
          "default": "5 s",
          "config_path": "Not directly configurable (RFC constant)",
          "version_range": {
            "min": "*",
            "max": "*"
          }
        },
        {
          "os": "iosxe",
          "default": "5 s",
          "config_path": "Not directly configurable (RFC constant)",
          "version_range": {
            "min": "*",
            "max": "*"
          }
        },
        {
          "os": "iosxr",
          "default": "5 s",
          "config_path": "Not directly configurable (RFC constant)",
          "version_range": {
            "min": "*",
            "max": "*"
          }
        },
        {